{
  "$schema": "../../schemas/skill-registry-v3.schema.json",
  "schema_version": 3,
  "registry_role": "project-skill-router-and-learning-index",
  "routing_policy": {
    "load_all_skills": false,
    "default_selection": "automatic-trigger-match",
    "automatic_selection": true,
    "user_skill_declaration_required": false,
    "require_trigger_match": true,
    "require_execution_report": true,
    "work_modes": ["PLAN", "BUILD", "REVIEW"],
    "max_primary_discipline_skills": 1,
    "max_foundation_skills": 3,
    "exclude_statuses": ["HOLD", "BACKUP", "REMOVAL_CANDIDATE"]
  },
  "base_integration": {
    "repository": "alsdmlals4-eng/Base",
    "commit": "41a20584dd2ee51d917e5c9d7cab6838e1ceba7e",
    "legacy_aliases": "skills/LEGACY_SKILL_ALIASES.md",
    "shared_learning_log": "skills/SKILL_LEARNING_LOG.md",
    "shared_extension_registry": "skills/BASE_SHARED_SKILL_ROUTES.json",
    "shared_extension_commit": "6a224e450f9420223c00921f3c56e051612f92ad",
    "shared_skill_routes": {
      "intake_and_work_contract": "managing-project-intake-and-work-contract",
      "operating_system": "managing-game-project-operating-system",
      "design_documents": "managing-design-documents",
      "skill_evolution": "evolving-project-discipline-skills",
      "context_and_handoff": "maintaining-project-context-and-handoff",
      "concept_and_research": "analyzing-and-refining-game-concepts",
      "vertical_slice": "designing-vertical-slices",
      "external_ai_worktrees": "orchestrating-deepseek-worktrees",
      "change_validation": "reviewing-and-validating-project-changes",
      "reference_freshness": "auditing-canonical-reference-freshness",
      "art_prompting": "designing-art-prompts-and-technique-cards",
      "runtime_ui_audit": "auditing-and-refining-ui-art",
      "base_proposals": "managing-base-change-proposals",
      "core_identification": "identifying-project-core",
      "core_establishment": "establishing-project-core",
      "adversarial_refinement": "running-adversarial-review-and-refinement",
      "contract_preserving_refactor": "refactoring-with-contract-preservation",
      "skill_body_simplification": "simplifying-skill-bodies",
      "stale_material_pruning": "pruning-stale-and-nonfunctional-material",
      "git_state_sync": "synchronizing-local-and-github-state",
      "long_task_continuity": "maintaining-long-running-task-continuity",
      "game_user_research": "governing-game-user-research-coverage",
      "user_learning_notes": "creating-user-learning-notes",
      "project_visual_dashboard": "building-project-visual-dashboards",
      "engine_runtime_diagnosis": "diagnosing-game-engine-runtime-failures",
      "legacy_retention_and_archives": "governing-legacy-retention-and-archives"
    }
  },
  "human_presentation": {
    "publication_policy": "source_only",
    "primary_reading_format": "SKILL_REGISTRY.json",
    "editable_derivative": null,
    "diagram_directory": null,
    "publication_manifest": null,
    "generator": null,
    "source_of_truth": "SKILL_REGISTRY.json",
    "markdown_summary": null
  },
  "skills": [
    {
      "skill_id": "ten-paces-game-design",
      "layer": "discipline",
      "discipline": "게임 디자인",
      "path": "skills/game-design/ten-paces-game-design/SKILL.md",
      "status": "ACTIVE",
      "load_by_default": false,
      "trigger_tags": ["combat-rule", "balance", "mastery", "tournament", "vertical-slice", "constraint", "poc", "playtest", "start-position", "clash", "ultimate"],
      "skill_modes": ["rule-update", "balance-review", "poc-contract", "playtest-recalibration"],
      "use_when": ["십보강호의 전투·성장·대회·무공·데모 규칙과 프로젝트 고유 완료 기준을 결정하거나 갱신한다."],
      "do_not_use_when": ["표현만 바뀌거나 공용 프로젝트 코어·벤치마킹·운영체계 절차만 필요한 경우다."],
      "learning_log": "skills/SKILL_LEARNING_LOG.md",
      "review_triggers": ["본책 수치 충돌", "제품 범위 변경", "플레이테스트 결과", "구현과 규칙 불일치", "전장·합·기세 변경"],
      "last_reviewed_at": "2026-07-23",
      "last_reviewed_commit": "4414322692dfea401d8c18381118772a3c79734f",
      "knowledge_state": "PATTERN"
    },
    {
      "skill_id": "combat-ux-and-accessibility",
      "layer": "discipline",
      "discipline": "UX·UI·접근성",
      "path": "skills/ux-ui-accessibility/combat-ux-and-accessibility/SKILL.md",
      "status": "ACTIVE",
      "load_by_default": false,
      "trigger_tags": ["combat-ui", "card-ui", "hud", "action-timing", "presentation", "accessibility", "runtime-ui-audit", "clash-ui", "ultimate-ui", "keyboard-focus"],
      "skill_modes": ["ui-contract", "runtime-review", "accessibility-review"],
      "use_when": ["전투 화면·카드·수 슬롯·HUD·연출·접근성 계약을 설계하거나 실제 Godot 결과를 검수한다."],
      "do_not_use_when": ["도메인 계산·AI·저장 로직만 변경하거나 새 이미지 프롬프트만 설계하는 경우다."],
      "learning_log": "skills/SKILL_LEARNING_LOG.md",
      "review_triggers": ["정보 판독 실패", "실제 렌더 불일치", "접근성 폴백 변경", "색상 단일 정보 채널", "위치·결과 표현 변경"],
      "last_reviewed_at": "2026-07-23",
      "last_reviewed_commit": "8f9736a14f566809024004d4f0e4122edaa1f117",
      "knowledge_state": "PATTERN"
    },
    {
      "skill_id": "combat-implementation-handoff",
      "layer": "discipline",
      "discipline": "개발·엔지니어링",
      "path": "skills/engineering/combat-implementation-handoff/SKILL.md",
      "status": "ACTIVE",
      "load_by_default": false,
      "trigger_tags": ["godot", "gdscript", "implementation", "architecture", "save-data", "data-contract", "combat-engine", "runtime-validation", "baseline-preservation", "ai"],
      "skill_modes": ["implementation-contract", "build", "runtime-handoff"],
      "use_when": ["승인된 십보강호 계약을 실제 Godot 파일·데이터·씬·자산·테스트로 변환하고 기준 SHA 대비 보존을 검증한다."],
      "do_not_use_when": ["실제 저장소 파일을 확인하지 않은 순수 기획·벤치마킹 대화다."],
      "learning_log": "skills/SKILL_LEARNING_LOG.md",
      "review_triggers": ["환각 경로", "저장 호환성 변경", "문서와 구현 불일치", "도메인 계산의 UI 침범", "Codex 변경 유실"],
      "last_reviewed_at": "2026-07-23",
      "last_reviewed_commit": "31be8b3d5826831df7946aeb427ed01c547c348b",
      "knowledge_state": "PATTERN"
    },
    {
      "skill_id": "ten-paces-verification",
      "layer": "discipline",
      "discipline": "QA",
      "path": "skills/qa/ten-paces-verification/SKILL.md",
      "status": "ACTIVE",
      "load_by_default": false,
      "trigger_tags": ["qa", "test", "regression", "playtest", "determinism", "build-approval", "reference-freshness", "edge-case", "counterexample", "baseline-diff"],
      "skill_modes": ["contract-check", "static-validation", "runtime-validation", "accessibility-review", "performance-profile", "regression", "evidence-report"],
      "use_when": ["십보강호 고유 규칙과 실제 Godot·데이터·빌드·플레이어 이해의 증거를 연결한다."],
      "do_not_use_when": ["프로젝트 고유 검증 대상이 없는 일반 운영체계 감사나 실행 없는 재보고다."],
      "learning_log": "skills/SKILL_LEARNING_LOG.md",
      "review_triggers": ["테스트 누락", "재현 실패", "체크리스트와 실행 불일치", "미검증 완료 주장", "기준 SHA 대비 파일 유실"],
      "last_reviewed_at": "2026-07-23",
      "last_reviewed_commit": "b0c611b85d6d4bba2e97f4b7c43fdd60a9beb477",
      "knowledge_state": "PATTERN"
    }
  ],
  "selected_disciplines": ["게임 디자인", "UX·UI·접근성", "개발·엔지니어링", "QA"],
  "discipline_entrypoints": {
    "설정·내러티브": [],
    "게임 디자인": ["ten-paces-game-design"],
    "UX·UI·접근성": ["combat-ux-and-accessibility"],
    "개발·엔지니어링": ["combat-implementation-handoff"],
    "테크니컬 아트·파이프라인": [],
    "아트": [],
    "사운드": [],
    "QA": ["ten-paces-verification"],
    "프로덕션·PM": [],
    "분석·유저리서치": [],
    "통합검수": []
  }
}
